{
  "name": "cloudflare",
  "version": "0.1.0",
  "description": "Cloudflare platform plugin with curated skills for Workers, Wrangler, and Agents SDK plus the official Cloudflare API MCP server.",
  "author": {
    "name": "Cloudflare",
    "url": "https://workers.cloudflare.com/"
  },
  "homepage": "https://workers.cloudflare.com/",
  "repository": "https://github.com/openai/plugins",
  "license": "MIT",
  "keywords": [
    "cloudflare",
    "workflow",
    "deployment",
    "edge-functions",
    "edge",
    "analytics",
    "wrangler",
    "agents-sdk",
    "serverless",
    "ai-gateway"
  ],
  "skills": "./skills/",
  "mcpServers": "./.mcp.json",
  "interface": {
    "displayName": "Cloudflare",
    "shortDescription": "Cloudflare platform guidance with official MCP",
    "longDescription": "Bring Cloudflare platform guidance into Codex with curated skills for the broader platform, Wrangler CLI, and the Agents SDK, plus the official Cloudflare API MCP server for authenticated access to live account data and workflows across Workers, Pages, storage, AI, networking, security, and analytics services.",
    "developerName": "Cloudflare",
    "category": "Coding",
    "capabilities": [
      "Interactive",
      "Write"
    ],
    "websiteURL": "https://workers.cloudflare.com/",
    "privacyPolicyURL": "https://www.cloudflare.com/privacypolicy/",
    "termsOfServiceURL": "https://www.cloudflare.com/website-terms/",
    "defaultPrompt": [
      "Help me choose the right Cloudflare product, configure Wrangler, and use Cloudflare MCP to inspect or deploy this project"
    ],
    "composerIcon": "./assets/cloudflare-small.svg",
    "logo": "./assets/cloudflare.png",
    "screenshots": [],
    "brandColor": "#F48120"
  }
}
